{
  "schema_version": "1.0.0",
  "node_id": "CMDG:ARITH.GCD",
  "node_type": "Theorem",
  "engagement_mode": "RECONSTRUCTED",
  "canonical_label": "Euclid GCD existence",
  "description": "Retained schema-only example node; no graph certification is conferred.",
  "foundational_profile_ref": "CLAIM_LEDGER_STANDARD.md#foundational_profile",
  "provenance_refs": [
    "EUCLID-GCD-E2E-001"
  ]
}
